{
  "schema_version": "1.0",
  "request_id": "req_health_001",
  "run_id": "run_health_001",
  "task_id": "task_health_001",
  "action_id": "act_health_001",
  "actor": {
    "actor_id": "agent_001",
    "actor_type": "agent",
    "display_name": "Example Agent"
  },
  "tool": {
    "name": "health.check",
    "capability_class": "L0"
  },
  "params": {},
  "environment": "dev",
  "requested_at": "2026-06-28T00:00:00Z",
  "orchestrator": {
    "name": "example",
    "run_reference": "orch_run_health_001"
  }
}
